{
  "resource": "architecture-interpretation/1.4/conformance",
  "semanticDependencies": [
    "architecture-interpretation/1.4/conformance.schema",
    "architecture-interpretation/1.4/required-output-derivations",
    "architecture-interpretation/1.4/rules",
    "authoring/1.7/schema/adr-common.schema",
    "authoring/1.7/schema/adr-logical.schema",
    "authoring/1.7/schema/adr-physical-component.schema",
    "authoring/1.7/schema/adr-physical-system.schema",
    "authoring/1.7/schema/types.schema"
  ],
  "authority_only": true,
  "runtime_execution_coverage": false,
  "cases": [
    {
      "id": "AI14-001",
      "category": "label_policy",
      "semantic_type": "adr/logical",
      "assertion": "Exactly selected authored placements or representation-only literal copies; original semantics retained once.",
      "expected": "conforms",
      "fixture": {
        "name": {
          "mode": "authored",
          "source_field": "title"
        },
        "summary": {
          "mode": "representation",
          "source_field": "context"
        }
      },
      "coverage": "authority_only_not_runtime_execution"
    },
    {
      "id": "AI14-002",
      "category": "label_policy",
      "semantic_type": "adr/physical-component",
      "assertion": "Exactly selected authored placements or representation-only literal copies; original semantics retained once.",
      "expected": "conforms",
      "fixture": {
        "name": {
          "mode": "authored",
          "source_field": "title"
        },
        "summary": {
          "mode": "representation",
          "source_field": "context"
        }
      },
      "coverage": "authority_only_not_runtime_execution"
    },
    {
      "id": "AI14-003",
      "category": "label_policy",
      "semantic_type": "adr/physical-system",
      "assertion": "Exactly selected authored placements or representation-only literal copies; original semantics retained once.",
      "expected": "conforms",
      "fixture": {
        "name": {
          "mode": "authored",
          "source_field": "title"
        },
        "summary": {
          "mode": "representation",
          "source_field": "context"
        }
      },
      "coverage": "authority_only_not_runtime_execution"
    },
    {
      "id": "AI14-004",
      "category": "label_policy",
      "semantic_type": "entity/boundary",
      "assertion": "Exactly selected authored placements or representation-only literal copies; original semantics retained once.",
      "expected": "conforms",
      "fixture": {
        "name": {
          "mode": "authored",
          "source_field": "name"
        },
        "summary": {
          "mode": "representation",
          "source_field": "description"
        }
      },
      "coverage": "authority_only_not_runtime_execution"
    },
    {
      "id": "AI14-005",
      "category": "label_policy",
      "semantic_type": "entity/capability",
      "assertion": "Exactly selected authored placements or representation-only literal copies; original semantics retained once.",
      "expected": "conforms",
      "fixture": {
        "name": {
          "mode": "authored",
          "source_field": "name"
        },
        "summary": {
          "mode": "representation",
          "source_field": "description"
        }
      },
      "coverage": "authority_only_not_runtime_execution"
    },
    {
      "id": "AI14-006",
      "category": "label_policy",
      "semantic_type": "entity/component",
      "assertion": "Exactly selected authored placements or representation-only literal copies; original semantics retained once.",
      "expected": "conforms",
      "fixture": {
        "name": {
          "mode": "authored",
          "source_field": "name"
        },
        "summary": {
          "mode": "representation",
          "source_field": "responsibilities"
        }
      },
      "coverage": "authority_only_not_runtime_execution"
    },
    {
      "id": "AI14-007",
      "category": "label_policy",
      "semantic_type": "entity/contract",
      "assertion": "Exactly selected authored placements or representation-only literal copies; original semantics retained once.",
      "expected": "conforms",
      "fixture": {
        "name": {
          "mode": "representation",
          "source_field": "alias_name"
        },
        "summary": {
          "mode": "representation",
          "source_field": "guarantees"
        }
      },
      "coverage": "authority_only_not_runtime_execution"
    },
    {
      "id": "AI14-008",
      "category": "label_policy",
      "semantic_type": "entity/data_flow",
      "assertion": "Exactly selected authored placements or representation-only literal copies; original semantics retained once.",
      "expected": "conforms",
      "fixture": {
        "name": {
          "mode": "authored",
          "source_field": "name"
        },
        "summary": {
          "mode": "representation",
          "source_field": "description"
        }
      },
      "coverage": "authority_only_not_runtime_execution"
    },
    {
      "id": "AI14-009",
      "category": "label_policy",
      "semantic_type": "entity/decision",
      "assertion": "Exactly selected authored placements or representation-only literal copies; original semantics retained once.",
      "expected": "conforms",
      "fixture": {
        "name": {
          "mode": "representation",
          "source_field": "alias_name"
        },
        "summary": {
          "mode": "authored",
          "source_field": "summary"
        }
      },
      "coverage": "authority_only_not_runtime_execution"
    },
    {
      "id": "AI14-010",
      "category": "label_policy",
      "semantic_type": "entity/evidence_expectation",
      "assertion": "Exactly selected authored placements or representation-only literal copies; original semantics retained once.",
      "expected": "conforms",
      "fixture": {
        "name": {
          "mode": "representation",
          "source_field": "alias_name"
        },
        "summary": {
          "mode": "representation",
          "source_field": "description"
        }
      },
      "coverage": "authority_only_not_runtime_execution"
    },
    {
      "id": "AI14-011",
      "category": "label_policy",
      "semantic_type": "entity/extension",
      "assertion": "Exactly selected authored placements or representation-only literal copies; original semantics retained once.",
      "expected": "conforms",
      "fixture": {
        "name": {
          "mode": "representation",
          "source_field": "alias_name"
        },
        "summary": {
          "mode": "representation",
          "source_field": "rationale"
        }
      },
      "coverage": "authority_only_not_runtime_execution"
    },
    {
      "id": "AI14-012",
      "category": "label_policy",
      "semantic_type": "entity/gap",
      "assertion": "Exactly selected authored placements or representation-only literal copies; original semantics retained once.",
      "expected": "conforms",
      "fixture": {
        "name": {
          "mode": "representation",
          "source_field": "alias_name"
        },
        "summary": {
          "mode": "representation",
          "source_field": "question"
        }
      },
      "coverage": "authority_only_not_runtime_execution"
    },
    {
      "id": "AI14-013",
      "category": "label_policy",
      "semantic_type": "entity/implementation_decision",
      "assertion": "Exactly selected authored placements or representation-only literal copies; original semantics retained once.",
      "expected": "conforms",
      "fixture": {
        "name": {
          "mode": "representation",
          "source_field": "alias_name"
        },
        "summary": {
          "mode": "authored",
          "source_field": "summary"
        }
      },
      "coverage": "authority_only_not_runtime_execution"
    },
    {
      "id": "AI14-014",
      "category": "label_policy",
      "semantic_type": "entity/interface",
      "assertion": "Exactly selected authored placements or representation-only literal copies; original semantics retained once.",
      "expected": "conforms",
      "fixture": {
        "name": {
          "mode": "representation",
          "source_field": "alias_name"
        },
        "summary": {
          "mode": "representation",
          "source_field": "specification"
        }
      },
      "coverage": "authority_only_not_runtime_execution"
    },
    {
      "id": "AI14-015",
      "category": "label_policy",
      "semantic_type": "entity/invariant",
      "assertion": "Exactly selected authored placements or representation-only literal copies; original semantics retained once.",
      "expected": "conforms",
      "fixture": {
        "name": {
          "mode": "representation",
          "source_field": "alias_name"
        },
        "summary": {
          "mode": "representation",
          "source_field": "statement"
        }
      },
      "coverage": "authority_only_not_runtime_execution"
    },
    {
      "id": "AI14-016",
      "category": "label_policy",
      "semantic_type": "entity/normative_proposition",
      "assertion": "Exactly selected authored placements or representation-only literal copies; original semantics retained once.",
      "expected": "conforms",
      "fixture": {
        "name": {
          "mode": "representation",
          "source_field": "alias_name"
        },
        "summary": {
          "mode": "representation",
          "source_field": "statement"
        }
      },
      "coverage": "authority_only_not_runtime_execution"
    },
    {
      "id": "AI14-017",
      "category": "label_policy",
      "semantic_type": "entity/system",
      "assertion": "Exactly selected authored placements or representation-only literal copies; original semantics retained once.",
      "expected": "conforms",
      "fixture": {
        "name": {
          "mode": "representation",